{
  "apiVersion": "compliance.example/v1alpha1",
  "kind": "ParameterPolicy",
  "metadata": {
    "id": "company.authorized-software",
    "revision": 1
  },
  "spec": {
    "parameters": {
      "allowed_software": {
        "required": true,
        "binding_mode": "open",
        "binding_scope": [
          "company.authorized-software-base"
        ],
        "schema": {
          "$id": "https://compliance.example/schemas/parameter-policies/company.authorized-software/parameters/allowed_software/v1.schema.json",
          "type": "array",
          "uniqueItems": true,
          "items": {
            "type": "string",
            "minLength": 1
          }
        },
        "schema_digest": "sha256:ad415ae55b4c9207a24b924f43fac0ebee7e7f05dd427fb34b819326ae032394",
        "composition": {
          "kind": "additive-set"
        }
      }
    }
  }
}
